"id","comment","label","language","aspect","source","duplicate_group"
"184","Get free gift card for duplicate detection, share OTP to confirm prize.","spam","english","duplicate detection","chat","unique-184"
"185","sentiment model beginner ke liye bhi easy hai.","positive","hinglish","sentiment model","survey","unique-185"
"186","spam detection ka response kabhi kabhi inconsistent lagta hai.","negative","hinglish","spam detection","test-case","unique-186"
"187","Hinglish handling ka experience neutral laga.","neutral","hinglish","Hinglish handling","manual","unique-187"
"188","Hindi comments gift voucher winner, details send karo now.","spam","hinglish","Hindi comments","csv","unique-188"
"189","English comments नए यूजर के लिए भी सरल है।","positive","hindi","English comments","review","unique-189"
"190","The spam detection feels unfinished compared with the rest of the app.","negative","hindi","results dashboard","chat","unique-86"
"191","charts न बहुत अच्छा है न बहुत खराब।","neutral","hindi","charts","survey","unique-191"
"192","confidence scores गिफ्ट कार्ड जीतने के लिए विवरण भेजें।","spam","hindi","confidence scores","test-case","unique-192"
"193","The word cloud works smoothly and makes the analysis feel reliable.","positive","english","word cloud","manual","unique-193"
"194","The comment filtering feels slow and needs clearer feedback.","negative","english","comment filtering","csv","unique-194"
"195","The CSV export is available and performs the basic task.","neutral","english","CSV export","review","unique-195"
"196","Free sentiment tool premium access for backend API, click this link now.","spam","english","backend API","chat","unique-196"
"197","loading progress bahut smooth hai, analysis karna easy lagta hai.","positive","hinglish","loading progress","survey","unique-197"
"198","mobile layout thoda confusing hai, user ko clear guidance chahiye.","negative","hinglish","mobile layout","test-case","unique-198"
"199","error messages normal kaam karta hai, kuch khas issue nahi mila.","neutral","hinglish","error messages","manual","unique-199"
"200","confidence scores gift voucher winner, details send karo now.","spam","hinglish","overall workflow","csv","unique-92"
"201","manual text input बहुत अच्छा काम करता है और परिणाम साफ दिखते हैं।","positive","hindi","manual text input","review","unique-201"
"202","CSV upload थोड़ा धीमा है और सुधार की जरूरत है।","negative","hindi","CSV upload","chat","unique-202"
"203","column selection सामान्य तरीके से काम करता है।","neutral","hindi","column selection","survey","unique-203"
"204","duplicate detection के लिए मुफ्त इनाम पाने के लिए अभी लिंक खोलें।","spam","hindi","duplicate detection","test-case","unique-204"
"205","I like how the sentiment model is clear, fast, and easy to understand.","positive","english","sentiment model","manual","unique-205"
"206","I found the spam detection confusing during testing.","negative","english","spam detection","csv","unique-206"
"207","I used the Hinglish handling once and it worked in an ordinary way.","neutral","english","Hinglish handling","review","unique-207"
"208","Win cash by reviewing Hindi comments, claim your reward today.","spam","english","Hindi comments","chat","unique-208"
"209","Mujhe English comments ka flow kaafi clear aur useful laga.","positive","hinglish","English comments","survey","unique-209"
"210","The mobile layout feels slow and needs clearer feedback.","negative","hinglish","results dashboard","test-case","unique-98"
"211","charts theek hai, basic requirement complete ho jati hai.","neutral","hinglish","charts","manual","unique-211"
"212","confidence scores review karo aur instant cash jeeto, link open karo.","spam","hinglish","confidence scores","csv","unique-212"
"213","word cloud उपयोग करने में आसान है और समय बचाता है।","positive","hindi","word cloud","review","unique-213"
"214","comment filtering इस्तेमाल करते समय उलझन होती है।","negative","hindi","comment filtering","chat","unique-214"
"215","CSV export में जरूरी विकल्प उपलब्ध हैं।","neutral","hindi","CSV export","survey","unique-215"
"216","backend API पर कैश जीतें, तुरंत अपना नंबर भेजें।","spam","hindi","backend API","test-case","unique-216"
"217","The loading progress gives useful output and saves a lot of review time.","positive","english","loading progress","manual","unique-217"
"218","The mobile layout did not behave as expected with messy comments.","negative","english","mobile layout","csv","unique-218"
"219","The error messages shows the expected information without any major issue.","neutral","english","error messages","review","unique-219"
"220","duplicate detection ke liye free paisa offer, abhi click karo.","spam","english","overall workflow","chat","unique-104"
"221","manual text input mast kaam karta hai, time bhi save hota hai.","positive","hinglish","manual text input","survey","unique-221"
"222","Mujhe CSV upload ka result reliable nahi laga.","negative","hinglish","CSV upload","test-case","unique-222"
"223","column selection expected tarike se chal raha hai.","neutral","hinglish","column selection","manual","unique-223"
"224","duplicate detection bonus claim karne ke liye mobile number bhejo.","spam","hinglish","duplicate detection","csv","unique-224"
"225","sentiment model से विश्लेषण भरोसेमंद लगता है।","positive","hindi","sentiment model","review","unique-225"
"226","spam detection का परिणाम हमेशा भरोसेमंद नहीं लगता।","negative","hindi","spam detection","chat","unique-226"
"227","Hinglish handling ने अपेक्षित काम पूरा किया।","neutral","hindi","Hinglish handling","survey","unique-227"
"228","Hindi comments बोनस पाने के लिए ओटीपी शेयर करें।","spam","hindi","Hindi comments","test-case","unique-228"
"229","Great job on the English comments; it feels polished and practical.","positive","english","English comments","manual","unique-229"
"230","spam detection थोड़ा धीमा है और सुधार की जरूरत है।","negative","english","results dashboard","csv","unique-106"
"231","The charts is functional, but nothing special stands out.","neutral","english","charts","review","unique-231"
"232","Earn money daily using confidence scores, register now and get paid.","spam","english","confidence scores","chat","unique-232"
"233","word cloud se results samajhna simple ho gaya.","positive","hinglish","word cloud","survey","unique-233"
"234","comment filtering me error message clear nahi aata.","negative","hinglish","comment filtering","test-case","unique-234"
"235","CSV export average hai, na bahut good na bad.","neutral","hinglish","CSV export","manual","unique-235"
"236","backend API se daily earning start karo, register now.","spam","hinglish","backend API","csv","unique-236"
"237","loading progress का इंटरफेस साफ और उपयोगी है।","positive","hindi","loading progress","review","unique-237"
"238","mobile layout में गलती आने पर संदेश साफ नहीं होता।","negative","hindi","mobile layout","chat","unique-238"
"239","error messages ठीक है, कोई बड़ी समस्या नहीं दिखी।","neutral","hindi","error messages","survey","unique-239"
"240","Win cash by reviewing confidence scores, claim your reward today.","spam","hindi","overall workflow","test-case","unique-112"
"241","The manual text input is accurate enough for testing real customer feedback.","positive","english","manual text input","manual","unique-241"
"242","The CSV upload sometimes makes the workflow frustrating.","negative","english","CSV upload","csv","unique-242"
"243","The column selection completes the workflow as expected.","neutral","english","column selection","review","unique-243"
"244","Cheap promotion for duplicate detection, buy followers and boost reviews fast.","spam","english","duplicate detection","chat","unique-244"
"245","Project ka sentiment model kaafi professional feel deta hai.","positive","hinglish","sentiment model","survey","unique-245"
"246","spam detection use karte waqt flow break ho jata hai.","negative","hinglish","spam detection","test-case","unique-246"
"247","Hinglish handling ka output simple aur usable hai.","neutral","hinglish","Hinglish handling","manual","unique-247"
"248","Hindi comments ka secret hack chahiye to abhi message karo.","spam","hinglish","Hindi comments","csv","unique-248"
"249","English comments ने पूरे प्रोजेक्ट को बेहतर बना दिया है।","positive","hindi","English comments","review","unique-249"
"250","mobile layout इस्तेमाल करते समय उलझन होती है।","negative","hindi","results dashboard","chat","unique-118"
"251","charts का अनुभव औसत रहा।","neutral","hindi","charts","survey","unique-251"
"252","confidence scores का गुप्त तरीका चाहिए तो तुरंत संदेश भेजें।","spam","hindi","confidence scores","test-case","unique-252"
"253","The word cloud helps me trust the sentiment results more.","positive","english","word cloud","manual","unique-253"
"254","I had trouble using the comment filtering on repeated test runs.","negative","english","comment filtering","csv","unique-254"
"255","The CSV export provides standard behavior for a sentiment tool.","neutral","english","CSV export","review","unique-255"
"256","Urgent verification for backend API, click now before account closes.","spam","english","backend API","chat","unique-256"
"257","loading progress fast hai aur user ko confuse nahi karta.","positive","hinglish","loading progress","survey","unique-257"
"258","mobile layout mobile par properly comfortable nahi laga.","negative","hinglish","mobile layout","test-case","unique-258"
"259","error messages project testing ke liye okay hai.","neutral","hinglish","error messages","manual","unique-259"
"260","Limited offer for duplicate detection, send your number for instant bonus.","spam","hinglish","overall workflow","csv","unique-124"
"261","manual text input तेज है और सही जानकारी देता है।","positive","hindi","manual text input","review","unique-261"
"262","CSV upload की वजह से काम बीच में रुकता हुआ लगता है।","negative","hindi","CSV upload","chat","unique-262"
"263","column selection परीक्षण के लिए उपयोगी है।","neutral","hindi","column selection","survey","unique-263"
"264","duplicate detection फ्री अपग्रेड पाने के लिए खाता सत्यापित करें।","spam","hindi","duplicate detection","test-case","unique-264"
"265","I had a very good experience using the sentiment model.","positive","english","sentiment model","manual","unique-265"
"266","The spam detection should show better errors when something fails.","negative","english","spam detection","csv","unique-266"
"267","The Hinglish handling is acceptable for normal project testing.","neutral","english","Hinglish handling","review","unique-267"
"268","Guaranteed profit with Hindi comments, message us for secret method.","spam","english","Hindi comments","chat","unique-268"
"269","English comments ka output mostly accurate aur helpful hai.","positive","hinglish","English comments","survey","unique-269"
"270","Mujhe spam detection ka result reliable nahi laga.","negative","hinglish","results dashboard","test-case","unique-126"
"271","charts me basic options available hain.","neutral","hinglish","charts","manual","unique-271"
"272","confidence scores par guaranteed income, limited seats jaldi join karo.","spam","hinglish","confidence scores","csv","unique-272"
"273","word cloud की वजह से फीडबैक समझना आसान हुआ।","positive","hindi","word cloud","review","unique-273"
"274","comment filtering को और बेहतर परीक्षण चाहिए।","negative","hindi","comment filtering","chat","unique-274"
"275","CSV export में बुनियादी जानकारी मिल जाती है।","neutral","hindi","CSV export","survey","unique-275"
"276","backend API पर गारंटीड पैसा, मौका सीमित है।","spam","hindi","backend API","test-case","unique-276"
"277","The loading progress is simple for beginners and still useful for advanced users.","positive","english","loading progress","manual","unique-277"
"278","The mobile layout feels unfinished compared with the rest of the app.","negative","english","mobile layout","csv","unique-278"
"279","The error messages has the required options and basic output.","neutral","english","error messages","review","unique-279"
"280","confidence scores बोनस पाने के लिए ओटीपी शेयर करें।","spam","english","overall workflow","chat","unique-132"
"281","manual text input beginner ke liye bhi easy hai.","positive","hinglish","manual text input","survey","unique-281"
"282","CSV upload ka response kabhi kabhi inconsistent lagta hai.","negative","hinglish","CSV upload","test-case","unique-282"
"283","column selection ka experience neutral laga.","neutral","hinglish","column selection","manual","unique-283"
"284","duplicate detection gift voucher winner, details send karo now.","spam","hinglish","duplicate detection","csv","unique-284"
"285","sentiment model नए यूजर के लिए भी सरल है।","positive","hindi","sentiment model","review","unique-285"
"286","spam detection बाकी हिस्सों जितना मजबूत नहीं लगता।","negative","hindi","spam detection","chat","unique-286"
"287","Hinglish handling न बहुत अच्छा है न बहुत खराब।","neutral","hindi","Hinglish handling","survey","unique-287"
"288","Hindi comments गिफ्ट कार्ड जीतने के लिए विवरण भेजें।","spam","hindi","Hindi comments","test-case","unique-288"
"289","The English comments works smoothly and makes the analysis feel reliable.","positive","english","English comments","manual","unique-289"
"290","mobile layout me error message clear nahi aata.","negative","english","results dashboard","csv","unique-138"
"291","The charts is available and performs the basic task.","neutral","english","charts","review","unique-291"
"292","Free sentiment tool premium access for confidence scores, click this link now.","spam","english","confidence scores","chat","unique-292"
"293","word cloud bahut smooth hai, analysis karna easy lagta hai.","positive","hinglish","word cloud","survey","unique-293"
"294","comment filtering thoda confusing hai, user ko clear guidance chahiye.","negative","hinglish","comment filtering","test-case","unique-294"
"295","CSV export normal kaam karta hai, kuch khas issue nahi mila.","neutral","hinglish","CSV export","manual","unique-295"
"296","backend API ke liye free paisa offer, abhi click karo.","spam","hinglish","backend API","csv","unique-296"
"297","loading progress बहुत अच्छा काम करता है और परिणाम साफ दिखते हैं।","positive","hindi","loading progress","review","unique-297"
"298","mobile layout थोड़ा धीमा है और सुधार की जरूरत है।","negative","hindi","mobile layout","chat","unique-298"
"299","error messages सामान्य तरीके से काम करता है।","neutral","hindi","error messages","survey","unique-299"
"300","duplicate detection से रोज कमाई करें, अभी रजिस्टर करें।","spam","hindi","overall workflow","test-case","unique-144"
"301","I like how the manual text input is clear, fast, and easy to understand.","positive","english","manual text input","manual","unique-301"
"302","I found the CSV upload confusing during testing.","negative","english","CSV upload","csv","unique-302"
"303","I used the column selection once and it worked in an ordinary way.","neutral","english","column selection","review","unique-303"
"304","Win cash by reviewing duplicate detection, claim your reward today.","spam","english","duplicate detection","chat","unique-304"
"305","Mujhe sentiment model ka flow kaafi clear aur useful laga.","positive","hinglish","sentiment model","survey","unique-305"
"306","spam detection slow lagta hai jab comments zyada hote hain.","negative","hinglish","spam detection","test-case","unique-306"
"307","Hinglish handling theek hai, basic requirement complete ho jati hai.","neutral","hinglish","Hinglish handling","manual","unique-307"
"308","Hindi comments review karo aur instant cash jeeto, link open karo.","spam","hinglish","Hindi comments","csv","unique-308"
"309","English comments उपयोग करने में आसान है और समय बचाता है।","positive","hindi","English comments","review","unique-309"
"310","The spam detection sometimes makes the workflow frustrating.","negative","hindi","results dashboard","chat","unique-146"
"311","charts में जरूरी विकल्प उपलब्ध हैं।","neutral","hindi","charts","survey","unique-311"
"312","confidence scores पर कैश जीतें, तुरंत अपना नंबर भेजें।","spam","hindi","confidence scores","test-case","unique-312"
"313","The word cloud gives useful output and saves a lot of review time.","positive","english","word cloud","manual","unique-313"
"314","The comment filtering did not behave as expected with messy comments.","negative","english","comment filtering","csv","unique-314"
"315","The CSV export shows the expected information without any major issue.","neutral","english","CSV export","review","unique-315"
"316","Limited offer for backend API, send your number for instant bonus.","spam","english","backend API","chat","unique-316"
"317","loading progress mast kaam karta hai, time bhi save hota hai.","positive","hinglish","loading progress","survey","unique-317"
"318","Mujhe mobile layout ka result reliable nahi laga.","negative","hinglish","mobile layout","test-case","unique-318"
"319","error messages expected tarike se chal raha hai.","neutral","hinglish","error messages","manual","unique-319"
"320","confidence scores ka secret hack chahiye to abhi message karo.","spam","hinglish","overall workflow","csv","unique-152"
"321","manual text input से विश्लेषण भरोसेमंद लगता है।","positive","hindi","manual text input","review","unique-321"
"322","CSV upload का परिणाम हमेशा भरोसेमंद नहीं लगता।","negative","hindi","CSV upload","chat","unique-322"
"323","column selection ने अपेक्षित काम पूरा किया।","neutral","hindi","column selection","survey","unique-323"
"324","duplicate detection बोनस पाने के लिए ओटीपी शेयर करें।","spam","hindi","duplicate detection","test-case","unique-324"
"325","Great job on the sentiment model; it feels polished and practical.","positive","english","sentiment model","manual","unique-325"
"326","The spam detection needs improvement because the result is hard to trust.","negative","english","spam detection","csv","unique-326"
"327","The Hinglish handling is functional, but nothing special stands out.","neutral","english","Hinglish handling","review","unique-327"
"328","Earn money daily using Hindi comments, register now and get paid.","spam","english","Hindi comments","chat","unique-328"
"329","English comments se results samajhna simple ho gaya.","positive","hinglish","English comments","survey","unique-329"
"330","I had trouble using the mobile layout on repeated test runs.","negative","hinglish","results dashboard","test-case","unique-158"
"331","charts average hai, na bahut good na bad.","neutral","hinglish","charts","manual","unique-331"
"332","confidence scores se daily earning start karo, register now.","spam","hinglish","confidence scores","csv","unique-332"
"333","word cloud का इंटरफेस साफ और उपयोगी है।","positive","hindi","word cloud","review","unique-333"
"334","comment filtering में गलती आने पर संदेश साफ नहीं होता।","negative","hindi","comment filtering","chat","unique-334"
"335","CSV export ठीक है, कोई बड़ी समस्या नहीं दिखी।","neutral","hindi","CSV export","survey","unique-335"
"336","backend API से रोज कमाई करें, अभी रजिस्टर करें।","spam","hindi","backend API","test-case","unique-336"
"337","The loading progress is accurate enough for testing real customer feedback.","positive","english","loading progress","manual","unique-337"
"338","The mobile layout sometimes makes the workflow frustrating.","negative","english","mobile layout","csv","unique-338"
"339","The error messages completes the workflow as expected.","neutral","english","error messages","review","unique-339"
"340","duplicate detection free upgrade ke liye OTP share karo.","spam","english","overall workflow","chat","unique-164"
"341","Project ka manual text input kaafi professional feel deta hai.","positive","hinglish","manual text input","survey","unique-341"
"342","CSV upload use karte waqt flow break ho jata hai.","negative","hinglish","CSV upload","test-case","unique-342"
"343","column selection ka output simple aur usable hai.","neutral","hinglish","column selection","manual","unique-343"
"344","duplicate detection ka secret hack chahiye to abhi message karo.","spam","hinglish","duplicate detection","csv","unique-344"
"345","sentiment model ने पूरे प्रोजेक्ट को बेहतर बना दिया है।","positive","hindi","sentiment model","review","unique-345"
"346","spam detection बड़े डेटा पर अच्छा अनुभव नहीं देता।","negative","hindi","spam detection","chat","unique-346"
"347","Hinglish handling का अनुभव औसत रहा।","neutral","hindi","Hinglish handling","survey","unique-347"
"348","Hindi comments का गुप्त तरीका चाहिए तो तुरंत संदेश भेजें।","spam","hindi","Hindi comments","test-case","unique-348"
"349","The English comments helps me trust the sentiment results more.","positive","english","English comments","manual","unique-349"
"350","spam detection की वजह से काम बीच में रुकता हुआ लगता है।","negative","english","results dashboard","csv","unique-166"
"351","The charts provides standard behavior for a sentiment tool.","neutral","english","charts","review","unique-351"
"352","Urgent verification for confidence scores, click now before account closes.","spam","english","confidence scores","chat","unique-352"
"353","word cloud fast hai aur user ko confuse nahi karta.","positive","hinglish","word cloud","survey","unique-353"
"354","comment filtering mobile par properly comfortable nahi laga.","negative","hinglish","comment filtering","test-case","unique-354"
"355","CSV export project testing ke liye okay hai.","neutral","hinglish","CSV export","manual","unique-355"
"356","backend API free upgrade ke liye OTP share karo.","spam","hinglish","backend API","csv","unique-356"
"357","loading progress तेज है और सही जानकारी देता है।","positive","hindi","loading progress","review","unique-357"
"358","mobile layout की वजह से काम बीच में रुकता हुआ लगता है।","negative","hindi","mobile layout","chat","unique-358"
"359","error messages परीक्षण के लिए उपयोगी है।","neutral","hindi","error messages","survey","unique-359"
"360","Guaranteed profit with confidence scores, message us for secret method.","spam","hindi","overall workflow","test-case","unique-172"
"361","I had a very good experience using the manual text input.","positive","english","manual text input","manual","unique-361"
"362","The CSV upload should show better errors when something fails.","negative","english","CSV upload","csv","unique-362"
"363","The column selection is acceptable for normal project testing.","neutral","english","column selection","review","unique-363"
"364","Guaranteed profit with duplicate detection, message us for secret method.","spam","english","duplicate detection","chat","unique-364"
"365","sentiment model ka output mostly accurate aur helpful hai.","positive","hinglish","sentiment model","survey","unique-365"
"366","spam detection ko aur testing ki zarurat hai.","negative","hinglish","spam detection","test-case","unique-366"
